{"classification":"selector_error","depth":"argb32f","error_code":4,"gap_id":"gap-000026","host_identities":{"input":{"role":"input","sha256":"59dbddbbae1e3d3266f9a85a57f3d593bec2c7f8f7f12ea3a6a0c409bdebd753","size_bytes":3903},"runner":{"role":"runner","sha256":"bab2b22f0568bd61b48ca690ee64eb0922b41a4fd4b6496a918d72a8832c599e","size_bytes":14017536},"workers":[{"role":"worker-000","sha256":"1731b555aa869a3cfc4b97a3b7bf93d85e71f15def418fd7687a772cef3df16a","size_bytes":2430464}]},"missing_suites":[],"occurrence_count":1,"parameter_shape":[{"index":1,"type":"slider"}],"render_path":"smartfx","schema_version":2,"stage":"selector","time":{"scale":1,"value":1}}
